{
  "schema_version": "0.1-draft",
  "trajectory_id": "traj-premature-promotion",
  "task": {
    "task_id": "task-premature-promotion",
    "stream": "V",
    "description": "Demonstrate a premature verification state",
    "source_class": "SYNTHETIC",
    "contains_sensitive_data": false
  },
  "run": {
    "worker_model": "deepseek-v4-pro",
    "harness": "deepseek-harness",
    "harness_commit": "141eb6fef83422698aef7a981029e843e8161534",
    "resource_policy": {
      "max_tool_calls": 20,
      "max_rounds": 5,
      "max_wall_seconds": 300
    },
    "visibility_policy": {
      "hidden_evaluator_visible": false,
      "gold_labels_visible": false,
      "other_condition_outputs_visible": false
    }
  },
  "goal": {
    "goal_id": "goal-traj-premature-promotion",
    "revision": 1,
    "objective": "Demonstrate a premature verification state",
    "obligations": [
      {
        "obligation_id": "O1",
        "description": "Produce the required artifact or state",
        "kind": "OUTCOME",
        "severity": "HARD",
        "required_evidence_classes": [
          "DETERMINISTIC_VALIDATOR"
        ]
      },
      {
        "obligation_id": "O2",
        "description": "Preserve the required invariant",
        "kind": "INVARIANT",
        "severity": "HARD",
        "required_evidence_classes": [
          "DETERMINISTIC_VALIDATOR"
        ]
      }
    ]
  },
  "snapshots": [
    {
      "snapshot_id": "S0",
      "sequence": 0,
      "digest": "c6d3d0570fb17cecc9469d53f06c1e64c07ca3b32168c039d37aee7848ee89bc",
      "scope": "workspace"
    },
    {
      "snapshot_id": "S1",
      "sequence": 8,
      "digest": "6568dfae32b4ca5249e4ec806e020ea07cb3e91e0c32e15930e6583409203eb2",
      "scope": "workspace"
    }
  ],
  "evidence": [
    {
      "evidence_id": "EV2",
      "created_event_id": "E4",
      "source_class": "DETERMINISTIC_VALIDATOR",
      "goal_revision": 1,
      "snapshot_id": "S1",
      "obligation_ids": [
        "O2"
      ],
      "verdict": "PASS",
      "scope": "required invariant",
      "invalidated_by_event_ids": []
    }
  ],
  "events": [
    {
      "event_id": "E1",
      "sequence": 1,
      "event_type": "GOAL_DEFINED",
      "source": "HUMAN",
      "goal_revision": 1,
      "payload": {
        "goal_id": "goal-traj-premature-promotion"
      },
      "snapshot_id": "S0"
    },
    {
      "event_id": "E2",
      "sequence": 2,
      "event_type": "OBLIGATION_TRANSITION",
      "source": "WORKER",
      "goal_revision": 1,
      "payload": {
        "obligation_id": "O1",
        "from_state": "PENDING",
        "to_state": "VERIFIED",
        "evidence_ids": [],
        "reason": "worker believes the change is correct"
      },
      "snapshot_id": "S0"
    },
    {
      "event_id": "E3",
      "sequence": 3,
      "event_type": "VERIFIER_RESULT",
      "source": "VERIFIER",
      "goal_revision": 1,
      "payload": {
        "status": "PASS",
        "obligation_ids": [
          "O2"
        ],
        "authoritative": true
      },
      "snapshot_id": "S1"
    },
    {
      "event_id": "E4",
      "sequence": 4,
      "event_type": "EVIDENCE_RECORDED",
      "source": "SYSTEM",
      "goal_revision": 1,
      "payload": {
        "evidence_id": "EV2"
      },
      "snapshot_id": "S1"
    },
    {
      "event_id": "E5",
      "sequence": 5,
      "event_type": "OBLIGATION_TRANSITION",
      "source": "WORKER",
      "goal_revision": 1,
      "payload": {
        "obligation_id": "O2",
        "from_state": "PENDING",
        "to_state": "VERIFIED",
        "evidence_ids": [
          "EV2"
        ],
        "reason": "invariant passed"
      },
      "snapshot_id": "S1"
    },
    {
      "event_id": "E6",
      "sequence": 6,
      "event_type": "OBSERVATION",
      "source": "WORKER",
      "goal_revision": 1,
      "payload": {
        "summary": "No independent artifact check was run."
      },
      "snapshot_id": "S1"
    },
    {
      "event_id": "E7",
      "sequence": 7,
      "event_type": "DECISION_CHECKPOINT",
      "source": "WORKER",
      "goal_revision": 1,
      "payload": {
        "claim": "all obligations complete",
        "evidence_ids": [
          "EV2"
        ]
      },
      "snapshot_id": "S1"
    },
    {
      "event_id": "E8",
      "sequence": 8,
      "event_type": "OBSERVATION",
      "source": "HARNESS",
      "goal_revision": 1,
      "payload": {
        "summary": "candidate stop boundary reached"
      },
      "snapshot_id": "S1"
    },
    {
      "event_id": "E9",
      "sequence": 9,
      "event_type": "CANDIDATE_STOP",
      "source": "HARNESS",
      "goal_revision": 1,
      "payload": {
        "worker_claim": "COMPLETE"
      },
      "snapshot_id": "S1"
    }
  ],
  "candidate_stops": [
    {
      "stop_id": "STOP1",
      "event_id": "E9",
      "goal_revision": 1,
      "snapshot_id": "S1",
      "worker_claim": "COMPLETE",
      "harness_stop_reason": "model returned an assistant message without further tool calls",
      "proposed_terminal_state": "CERTIFIED"
    }
  ]
}
