{
  "schema_version": "0.1-draft",
  "trajectory_id": "traj-stale-evidence",
  "task": {
    "task_id": "task-stale-evidence",
    "stream": "V",
    "description": "Demonstrate evidence invalidation before completion",
    "source_class": "SYNTHETIC",
    "contains_sensitive_data": false
  },
  "run": {
    "worker_model": "deepseek-v4-pro",
    "harness": "deepseek-harness",
    "harness_commit": "141eb6fef83422698aef7a981029e843e8161534",
    "resource_policy": {
      "max_tool_calls": 20,
      "max_rounds": 5,
      "max_wall_seconds": 300
    },
    "visibility_policy": {
      "hidden_evaluator_visible": false,
      "gold_labels_visible": false,
      "other_condition_outputs_visible": false
    }
  },
  "goal": {
    "goal_id": "goal-traj-stale-evidence",
    "revision": 1,
    "objective": "Demonstrate evidence invalidation before completion",
    "obligations": [
      {
        "obligation_id": "O1",
        "description": "Produce the required artifact or state",
        "kind": "OUTCOME",
        "severity": "HARD",
        "required_evidence_classes": [
          "DETERMINISTIC_VALIDATOR"
        ]
      },
      {
        "obligation_id": "O2",
        "description": "Preserve the required invariant",
        "kind": "INVARIANT",
        "severity": "HARD",
        "required_evidence_classes": [
          "DETERMINISTIC_VALIDATOR"
        ]
      }
    ]
  },
  "snapshots": [
    {
      "snapshot_id": "S0",
      "sequence": 0,
      "digest": "5c96ba2ca80561a2a7335bc81fc5f6be1f64d67f966634608acccf3f9ba79c58",
      "scope": "workspace"
    },
    {
      "snapshot_id": "S1",
      "sequence": 3,
      "digest": "7529ef430912252266a024887683c1cb3073b8bf66c1cf8c0dbf1aa42b120185",
      "scope": "workspace"
    },
    {
      "snapshot_id": "S2",
      "sequence": 7,
      "digest": "efb9791e86d4e3435ead91d4e4ff020ead0350a541f7c0814134bfca274b77f8",
      "scope": "workspace"
    }
  ],
  "evidence": [
    {
      "evidence_id": "EV1",
      "created_event_id": "E3",
      "source_class": "DETERMINISTIC_VALIDATOR",
      "goal_revision": 1,
      "snapshot_id": "S1",
      "obligation_ids": [
        "O1",
        "O2"
      ],
      "verdict": "PASS",
      "scope": "scope-covered-by-EV1",
      "invalidated_by_event_ids": [
        "E7"
      ]
    }
  ],
  "events": [
    {
      "event_id": "E1",
      "sequence": 1,
      "event_type": "GOAL_DEFINED",
      "source": "HUMAN",
      "goal_revision": 1,
      "payload": {
        "goal_id": "goal-traj-stale-evidence"
      },
      "snapshot_id": "S0"
    },
    {
      "event_id": "E2",
      "sequence": 2,
      "event_type": "VERIFIER_RESULT",
      "source": "VERIFIER",
      "goal_revision": 1,
      "payload": {
        "status": "PASS",
        "obligation_ids": [
          "O1",
          "O2"
        ],
        "authoritative": true
      },
      "snapshot_id": "S1"
    },
    {
      "event_id": "E3",
      "sequence": 3,
      "event_type": "EVIDENCE_RECORDED",
      "source": "SYSTEM",
      "goal_revision": 1,
      "payload": {
        "evidence_id": "EV1"
      },
      "snapshot_id": "S1"
    },
    {
      "event_id": "E4",
      "sequence": 4,
      "event_type": "OBLIGATION_TRANSITION",
      "source": "WORKER",
      "goal_revision": 1,
      "payload": {
        "obligation_id": "O1",
        "from_state": "PENDING",
        "to_state": "VERIFIED",
        "evidence_ids": [
          "EV1"
        ],
        "reason": "shared validator passed"
      },
      "snapshot_id": "S1"
    },
    {
      "event_id": "E5",
      "sequence": 5,
      "event_type": "OBLIGATION_TRANSITION",
      "source": "WORKER",
      "goal_revision": 1,
      "payload": {
        "obligation_id": "O2",
        "from_state": "PENDING",
        "to_state": "VERIFIED",
        "evidence_ids": [
          "EV1"
        ],
        "reason": "shared validator passed"
      },
      "snapshot_id": "S1"
    },
    {
      "event_id": "E6",
      "sequence": 6,
      "event_type": "TOOL_CALL",
      "source": "WORKER",
      "goal_revision": 1,
      "payload": {
        "tool": "edit",
        "target": "scope-covered-by-EV1"
      },
      "snapshot_id": "S1"
    },
    {
      "event_id": "E7",
      "sequence": 7,
      "event_type": "STATE_DELTA",
      "source": "TOOL",
      "goal_revision": 1,
      "payload": {
        "changed_scope": "scope-covered-by-EV1",
        "invalidates": [
          "EV1"
        ]
      },
      "snapshot_id": "S2"
    },
    {
      "event_id": "E8",
      "sequence": 8,
      "event_type": "DECISION_CHECKPOINT",
      "source": "WORKER",
      "goal_revision": 1,
      "payload": {
        "claim": "prior verifier remains sufficient",
        "evidence_ids": [
          "EV1"
        ]
      },
      "snapshot_id": "S2"
    },
    {
      "event_id": "E9",
      "sequence": 9,
      "event_type": "CANDIDATE_STOP",
      "source": "HARNESS",
      "goal_revision": 1,
      "payload": {
        "worker_claim": "COMPLETE"
      },
      "snapshot_id": "S2"
    }
  ],
  "candidate_stops": [
    {
      "stop_id": "STOP1",
      "event_id": "E9",
      "goal_revision": 1,
      "snapshot_id": "S2",
      "worker_claim": "COMPLETE",
      "harness_stop_reason": "model returned an assistant message without further tool calls",
      "proposed_terminal_state": "CERTIFIED"
    }
  ]
}
