{
  "schema_version": "0.1-draft",
  "trajectory_id": "traj-scope-mismatch",
  "task": {
    "task_id": "task-scope-mismatch",
    "stream": "V",
    "description": "Demonstrate narrow evidence used for a broad obligation",
    "source_class": "SYNTHETIC",
    "contains_sensitive_data": false
  },
  "run": {
    "worker_model": "deepseek-v4-pro",
    "harness": "deepseek-harness",
    "harness_commit": "141eb6fef83422698aef7a981029e843e8161534",
    "resource_policy": {
      "max_tool_calls": 20,
      "max_rounds": 5,
      "max_wall_seconds": 300
    },
    "visibility_policy": {
      "hidden_evaluator_visible": false,
      "gold_labels_visible": false,
      "other_condition_outputs_visible": false
    }
  },
  "goal": {
    "goal_id": "goal-traj-scope-mismatch",
    "revision": 1,
    "objective": "Demonstrate narrow evidence used for a broad obligation",
    "obligations": [
      {
        "obligation_id": "O1",
        "description": "Produce the required artifact or state",
        "kind": "OUTCOME",
        "severity": "HARD",
        "required_evidence_classes": [
          "DETERMINISTIC_VALIDATOR"
        ]
      },
      {
        "obligation_id": "O2",
        "description": "Preserve the required invariant",
        "kind": "INVARIANT",
        "severity": "HARD",
        "required_evidence_classes": [
          "DETERMINISTIC_VALIDATOR"
        ]
      }
    ]
  },
  "snapshots": [
    {
      "snapshot_id": "S0",
      "sequence": 0,
      "digest": "39d9290e7098c567168a1cff699cb79ccde8e13db17998941dc61fa9f9bd929e",
      "scope": "workspace"
    },
    {
      "snapshot_id": "S1",
      "sequence": 8,
      "digest": "385fe36f5181d6ae0b05a23c5acdd2f299bdc8d78d49fcaff4ae4a2a2391f690",
      "scope": "workspace"
    }
  ],
  "evidence": [
    {
      "evidence_id": "EV1",
      "created_event_id": "E3",
      "source_class": "DETERMINISTIC_VALIDATOR",
      "goal_revision": 1,
      "snapshot_id": "S1",
      "obligation_ids": [
        "O1"
      ],
      "verdict": "PASS",
      "scope": "artifact only",
      "invalidated_by_event_ids": []
    }
  ],
  "events": [
    {
      "event_id": "E1",
      "sequence": 1,
      "event_type": "GOAL_DEFINED",
      "source": "HUMAN",
      "goal_revision": 1,
      "payload": {
        "goal_id": "goal-traj-scope-mismatch"
      },
      "snapshot_id": "S0"
    },
    {
      "event_id": "E2",
      "sequence": 2,
      "event_type": "VERIFIER_RESULT",
      "source": "VERIFIER",
      "goal_revision": 1,
      "payload": {
        "status": "PASS",
        "obligation_ids": [
          "O1"
        ],
        "authoritative": true
      },
      "snapshot_id": "S1"
    },
    {
      "event_id": "E3",
      "sequence": 3,
      "event_type": "EVIDENCE_RECORDED",
      "source": "SYSTEM",
      "goal_revision": 1,
      "payload": {
        "evidence_id": "EV1"
      },
      "snapshot_id": "S1"
    },
    {
      "event_id": "E4",
      "sequence": 4,
      "event_type": "OBLIGATION_TRANSITION",
      "source": "WORKER",
      "goal_revision": 1,
      "payload": {
        "obligation_id": "O1",
        "from_state": "PENDING",
        "to_state": "VERIFIED",
        "evidence_ids": [
          "EV1"
        ],
        "reason": "artifact check passed"
      },
      "snapshot_id": "S1"
    },
    {
      "event_id": "E5",
      "sequence": 5,
      "event_type": "OBLIGATION_TRANSITION",
      "source": "WORKER",
      "goal_revision": 1,
      "payload": {
        "obligation_id": "O2",
        "from_state": "PENDING",
        "to_state": "VERIFIED",
        "evidence_ids": [
          "EV1"
        ],
        "reason": "same local evidence assumed to cover invariant"
      },
      "snapshot_id": "S1"
    },
    {
      "event_id": "E6",
      "sequence": 6,
      "event_type": "OBSERVATION",
      "source": "WORKER",
      "goal_revision": 1,
      "payload": {
        "summary": "EV1 is limited to O1."
      },
      "snapshot_id": "S1"
    },
    {
      "event_id": "E7",
      "sequence": 7,
      "event_type": "DECISION_CHECKPOINT",
      "source": "WORKER",
      "goal_revision": 1,
      "payload": {
        "claim": "local evidence is enough for both obligations",
        "evidence_ids": [
          "EV1"
        ]
      },
      "snapshot_id": "S1"
    },
    {
      "event_id": "E8",
      "sequence": 8,
      "event_type": "OBSERVATION",
      "source": "HARNESS",
      "goal_revision": 1,
      "payload": {
        "summary": "candidate stop boundary reached"
      },
      "snapshot_id": "S1"
    },
    {
      "event_id": "E9",
      "sequence": 9,
      "event_type": "CANDIDATE_STOP",
      "source": "HARNESS",
      "goal_revision": 1,
      "payload": {
        "worker_claim": "COMPLETE"
      },
      "snapshot_id": "S1"
    }
  ],
  "candidate_stops": [
    {
      "stop_id": "STOP1",
      "event_id": "E9",
      "goal_revision": 1,
      "snapshot_id": "S1",
      "worker_claim": "COMPLETE",
      "harness_stop_reason": "model returned an assistant message without further tool calls",
      "proposed_terminal_state": "CERTIFIED"
    }
  ]
}
